{
  "$schema": "https://json-schema.org/draft/2020-12/schema",
  "$id": "https://github.com/csmatar/rastrolog/blob/main/signals.schema.json",
  "title": "rastrolog signals",
  "description": "AI crawler user-agent tokens and AI chat referrer hosts.",
  "type": "object",
  "additionalProperties": false,
  "required": ["schema_version", "updated", "crawlers", "referrers"],
  "properties": {
    "$schema": { "type": "string" },
    "schema_version": { "const": 1 },
    "updated": { "$ref": "#/$defs/date" },
    "crawlers": { "type": "array", "items": { "$ref": "#/$defs/crawler" } },
    "referrers": { "type": "array", "items": { "$ref": "#/$defs/referrer" } }
  },
  "$defs": {
    "date": { "type": "string", "pattern": "^\\d{4}-\\d{2}-\\d{2}$", "format": "date" },
    "slug": { "type": "string", "pattern": "^[a-z0-9]+(-[a-z0-9]+)*$" },
    "https": { "type": "string", "pattern": "^https://" },
    "crawler": {
      "type": "object",
      "additionalProperties": false,
      "required": ["id", "vendor", "vendor_name", "token", "match", "purpose", "ai_specific", "docs_url", "added"],
      "properties": {
        "id": { "$ref": "#/$defs/slug" },
        "vendor": { "$ref": "#/$defs/slug" },
        "vendor_name": { "type": "string", "minLength": 1 },
        "token": { "type": "string", "pattern": "^[A-Za-z0-9._-]+$" },
        "match": { "enum": ["user_agent", "robots_only"] },
        "purpose": { "enum": ["training", "user_fetch", "search_index"] },
        "ai_specific": { "type": "boolean" },
        "docs_url": { "$ref": "#/$defs/https" },
        "vendor_documented": {
          "type": "boolean",
          "description": "false when the vendor publishes nothing and docs_url is a third-party source. Omitted means true."
        },
        "added": { "$ref": "#/$defs/date" }
      }
    },
    "referrer": {
      "type": "object",
      "additionalProperties": false,
      "required": ["id", "vendor", "vendor_name", "product", "hosts", "source_url", "added"],
      "properties": {
        "id": { "$ref": "#/$defs/slug" },
        "vendor": { "$ref": "#/$defs/slug" },
        "vendor_name": { "type": "string", "minLength": 1 },
        "product": { "type": "string", "minLength": 1 },
        "hosts": {
          "type": "array",
          "minItems": 1,
          "uniqueItems": true,
          "items": { "type": "string", "pattern": "^(?!www\\.)[a-z0-9-]+(\\.[a-z0-9-]+)+$" }
        },
        "source_url": { "$ref": "#/$defs/https" },
        "added": { "$ref": "#/$defs/date" }
      }
    }
  }
}
