{
  "$schema": "./signals.schema.json",
  "schema_version": 1,
  "updated": "2026-09-28",
  "crawlers": [
    { "id": "openai-gptbot", "vendor": "openai", "vendor_name": "OpenAI", "token": "GPTBot", "match": "user_agent", "purpose": "training", "ai_specific": true, "docs_url": "https://developers.openai.com/api/docs/bots", "added": "2026-09-28" },
    { "id": "openai-chatgpt-user", "vendor": "openai", "vendor_name": "OpenAI", "token": "ChatGPT-User", "match": "user_agent", "purpose": "user_fetch", "ai_specific": true, "docs_url": "https://developers.openai.com/api/docs/bots", "added": "2026-09-28" },
    { "id": "openai-oai-searchbot", "vendor": "openai", "vendor_name": "OpenAI", "token": "OAI-SearchBot", "match": "user_agent", "purpose": "search_index", "ai_specific": true, "docs_url": "https://developers.openai.com/api/docs/bots", "added": "2026-09-28" },
    { "id": "anthropic-claudebot", "vendor": "anthropic", "vendor_name": "Anthropic", "token": "ClaudeBot", "match": "user_agent", "purpose": "training", "ai_specific": true, "docs_url": "https://support.claude.com/en/articles/8896518-does-anthropic-crawl-data-from-the-web-and-how-can-site-owners-block-the-crawler", "added": "2026-09-28" },
    { "id": "anthropic-claude-user", "vendor": "anthropic", "vendor_name": "Anthropic", "token": "Claude-User", "match": "user_agent", "purpose": "user_fetch", "ai_specific": true, "docs_url": "https://support.claude.com/en/articles/8896518-does-anthropic-crawl-data-from-the-web-and-how-can-site-owners-block-the-crawler", "added": "2026-09-28" },
    { "id": "anthropic-claude-searchbot", "vendor": "anthropic", "vendor_name": "Anthropic", "token": "Claude-SearchBot", "match": "user_agent", "purpose": "search_index", "ai_specific": true, "docs_url": "https://support.claude.com/en/articles/8896518-does-anthropic-crawl-data-from-the-web-and-how-can-site-owners-block-the-crawler", "added": "2026-09-28" },
    { "id": "perplexity-perplexitybot", "vendor": "perplexity", "vendor_name": "Perplexity", "token": "PerplexityBot", "match": "user_agent", "purpose": "search_index", "ai_specific": true, "docs_url": "https://docs.perplexity.ai/guides/bots", "added": "2026-09-28" },
    { "id": "perplexity-perplexity-user", "vendor": "perplexity", "vendor_name": "Perplexity", "token": "Perplexity-User", "match": "user_agent", "purpose": "user_fetch", "ai_specific": true, "docs_url": "https://docs.perplexity.ai/guides/bots", "added": "2026-09-28" },
    { "id": "google-google-extended", "vendor": "google", "vendor_name": "Google", "token": "Google-Extended", "match": "robots_only", "purpose": "training", "ai_specific": true, "docs_url": "https://developers.google.com/search/docs/crawling-indexing/google-common-crawlers", "added": "2026-09-28" },
    { "id": "google-googlebot", "vendor": "google", "vendor_name": "Google", "token": "Googlebot", "match": "user_agent", "purpose": "search_index", "ai_specific": false, "docs_url": "https://developers.google.com/search/docs/crawling-indexing/google-common-crawlers", "added": "2026-09-28" },
    { "id": "google-google-agent", "vendor": "google", "vendor_name": "Google", "token": "Google-Agent", "match": "user_agent", "purpose": "user_fetch", "ai_specific": true, "docs_url": "https://developers.google.com/search/docs/crawling-indexing/google-user-triggered-fetchers", "added": "2026-09-28" },
    { "id": "google-google-gemininotebook", "vendor": "google", "vendor_name": "Google", "token": "Google-GeminiNotebook", "match": "user_agent", "purpose": "user_fetch", "ai_specific": true, "docs_url": "https://developers.google.com/search/docs/crawling-indexing/google-user-triggered-fetchers", "added": "2026-09-28" },
    { "id": "microsoft-bingbot", "vendor": "microsoft", "vendor_name": "Microsoft", "token": "bingbot", "match": "user_agent", "purpose": "search_index", "ai_specific": false, "docs_url": "https://blogs.bing.com/webmaster/2022/4/Announcing-user-agent-change-for-Bing-crawler-bingbot/", "added": "2026-09-28" },
    { "id": "commoncrawl-ccbot", "vendor": "commoncrawl", "vendor_name": "Common Crawl", "token": "CCBot", "match": "user_agent", "purpose": "training", "ai_specific": true, "docs_url": "https://commoncrawl.org/ccbot", "added": "2026-09-28" },
    { "id": "bytedance-bytespider", "vendor": "bytedance", "vendor_name": "ByteDance", "token": "Bytespider", "match": "user_agent", "purpose": "training", "ai_specific": true, "docs_url": "https://darkvisitors.com/agents/bytespider", "vendor_documented": false, "added": "2026-09-28" },
    { "id": "amazon-amazonbot", "vendor": "amazon", "vendor_name": "Amazon", "token": "Amazonbot", "match": "user_agent", "purpose": "training", "ai_specific": true, "docs_url": "https://developer.amazon.com/amazonbot", "added": "2026-09-28" },
    { "id": "amazon-amzn-searchbot", "vendor": "amazon", "vendor_name": "Amazon", "token": "Amzn-SearchBot", "match": "user_agent", "purpose": "search_index", "ai_specific": true, "docs_url": "https://developer.amazon.com/amazonbot", "added": "2026-09-28" },
    { "id": "amazon-amzn-user", "vendor": "amazon", "vendor_name": "Amazon", "token": "Amzn-User", "match": "user_agent", "purpose": "user_fetch", "ai_specific": true, "docs_url": "https://developer.amazon.com/amazonbot", "added": "2026-09-28" },
    { "id": "apple-applebot", "vendor": "apple", "vendor_name": "Apple", "token": "Applebot", "match": "user_agent", "purpose": "search_index", "ai_specific": false, "docs_url": "https://support.apple.com/en-us/119829", "added": "2026-09-28" },
    { "id": "apple-applebot-extended", "vendor": "apple", "vendor_name": "Apple", "token": "Applebot-Extended", "match": "robots_only", "purpose": "training", "ai_specific": true, "docs_url": "https://support.apple.com/en-us/119829", "added": "2026-09-28" },
    { "id": "meta-meta-externalagent", "vendor": "meta", "vendor_name": "Meta", "token": "meta-externalagent", "match": "user_agent", "purpose": "training", "ai_specific": true, "docs_url": "https://developers.facebook.com/documentation/sharing/webmasters/web-crawlers", "added": "2026-09-28" },
    { "id": "meta-meta-externalfetcher", "vendor": "meta", "vendor_name": "Meta", "token": "meta-externalfetcher", "match": "user_agent", "purpose": "user_fetch", "ai_specific": true, "docs_url": "https://developers.facebook.com/documentation/sharing/webmasters/web-crawlers", "added": "2026-09-28" },
    { "id": "meta-meta-webindexer", "vendor": "meta", "vendor_name": "Meta", "token": "meta-webindexer", "match": "user_agent", "purpose": "search_index", "ai_specific": true, "docs_url": "https://developers.facebook.com/documentation/sharing/webmasters/web-crawlers", "added": "2026-09-28" },
    { "id": "duckduckgo-duckassistbot", "vendor": "duckduckgo", "vendor_name": "DuckDuckGo", "token": "DuckAssistBot", "match": "user_agent", "purpose": "user_fetch", "ai_specific": true, "docs_url": "https://duckduckgo.com/duckduckgo-help-pages/results/duckassistbot", "added": "2026-09-28" },
    { "id": "you-youbot", "vendor": "you", "vendor_name": "You.com", "token": "YouBot", "match": "user_agent", "purpose": "search_index", "ai_specific": true, "docs_url": "https://you.com/docs/youbot", "added": "2026-09-28" },
    { "id": "mistral-mistralai-user", "vendor": "mistral", "vendor_name": "Mistral AI", "token": "MistralAI-User", "match": "user_agent", "purpose": "user_fetch", "ai_specific": true, "docs_url": "https://docs.mistral.ai/robots", "added": "2026-09-28" },
    { "id": "mistral-mistralai-index", "vendor": "mistral", "vendor_name": "Mistral AI", "token": "MistralAI-Index", "match": "user_agent", "purpose": "search_index", "ai_specific": true, "docs_url": "https://docs.mistral.ai/robots", "added": "2026-09-28" },
    { "id": "mistral-mistralai-training", "vendor": "mistral", "vendor_name": "Mistral AI", "token": "MistralAI-Training", "match": "user_agent", "purpose": "training", "ai_specific": true, "docs_url": "https://docs.mistral.ai/robots", "added": "2026-09-28" }
  ],
  "referrers": [
    { "id": "chatgpt", "vendor": "openai", "vendor_name": "OpenAI", "product": "ChatGPT", "hosts": ["chatgpt.com", "chat.openai.com"], "source_url": "https://github.com/matomo-org/searchengine-and-social-list/blob/master/AIAssistants.yml", "added": "2026-09-28" },
    { "id": "claude", "vendor": "anthropic", "vendor_name": "Anthropic", "product": "Claude", "hosts": ["claude.ai"], "source_url": "https://github.com/matomo-org/searchengine-and-social-list/blob/master/AIAssistants.yml", "added": "2026-09-28" },
    { "id": "perplexity", "vendor": "perplexity", "vendor_name": "Perplexity", "product": "Perplexity", "hosts": ["perplexity.ai", "pplx.ai"], "source_url": "https://github.com/plausible/analytics/blob/master/priv/custom_sources.json", "added": "2026-09-28" },
    { "id": "gemini", "vendor": "google", "vendor_name": "Google", "product": "Gemini", "hosts": ["gemini.google.com", "bard.google.com"], "source_url": "https://github.com/matomo-org/searchengine-and-social-list/blob/master/AIAssistants.yml", "added": "2026-09-28" },
    { "id": "notebooklm", "vendor": "google", "vendor_name": "Google", "product": "NotebookLM", "hosts": ["notebooklm.google.com"], "source_url": "https://github.com/matomo-org/searchengine-and-social-list/blob/master/AIAssistants.yml", "added": "2026-09-28" },
    { "id": "copilot", "vendor": "microsoft", "vendor_name": "Microsoft", "product": "Copilot", "hosts": ["copilot.microsoft.com", "copilot.com"], "source_url": "https://github.com/plausible/analytics/blob/master/priv/custom_sources.json", "added": "2026-09-28" },
    { "id": "you", "vendor": "you", "vendor_name": "You.com", "product": "You.com", "hosts": ["you.com"], "source_url": "https://github.com/matomo-org/searchengine-and-social-list/blob/master/AIAssistants.yml", "added": "2026-09-28" },